{
  "$schema": "https://json-schema.org/draft/2020-12/schema",
  "$id": "event-envelope.schema.json",
  "type": "object",
  "required": [
    "eventId",
    "eventType",
    "occurredAt",
    "producer",
    "workspaceId",
    "payloadVersion",
    "payload"
  ],
  "properties": {
    "eventId": { "type": "string" },
    "eventType": { "type": "string" },
    "occurredAt": { "type": "string" },
    "producer": { "type": "string" },
    "workspaceId": { "type": "string" },
    "payloadVersion": { "type": "string" },
    "payload": { "type": "object" }
  },
  "additionalProperties": false
}
