{
  "eventId": "evt-foundation-sheet-consumption-rolledback-edge-001",
  "eventType": "foundation.sheet.consumption.rolledback",
  "occurredAt": "2026-02-22T12:00:00Z",
  "producer": "foundation",
  "workspaceId": "workspace-edge",
  "payloadVersion": "1.0.0",
  "payload": {"recordId":"consume-edge-001","reservationId":"reserve-edge-001","reason":"sync_wms_failed"}
}
