{
  "eventId": "evt-drawing-demo-001",
  "eventType": "drawing.parts.ready",
  "occurredAt": "2026-02-10T10:01:00Z",
  "producer": "drawing-api",
  "workspaceId": "workspace-demo",
  "payloadVersion": "2.0.0",
  "payload": {
    "fileId": "drawing-file-demo-001",
    "partsCount": 1,
    "parts": [
      {
        "partId": "part-demo-001",
        "outerContour": {
          "contourId": "part-demo-001-outer",
          "closed": true,
          "points": [
            { "x": 0, "y": 0 },
            { "x": 180, "y": 0 },
            { "x": 180, "y": 90 },
            { "x": 0, "y": 90 }
          ]
        },
        "innerContours": [
          {
            "contourId": "part-demo-001-inner-1",
            "closed": true,
            "points": [
              { "x": 60, "y": 25 },
              { "x": 120, "y": 25 },
              { "x": 120, "y": 65 },
              { "x": 60, "y": 65 }
            ]
          }
        ],
        "sourceEntityIds": ["ent-demo-001-outer", "ent-demo-001-inner-1"],
        "bbox": { "minX": 0, "minY": 0, "maxX": 180, "maxY": 90 },
        "geometryVersion": "geom-v2-demo-001"
      }
    ]
  }
}
