{
  "eventId": "evt-foundation-sheet-consumption-committed-base-001",
  "eventType": "foundation.sheet.consumption.committed",
  "occurredAt": "2026-02-22T12:00:00Z",
  "producer": "foundation",
  "workspaceId": "workspace-base",
  "payloadVersion": "1.0.0",
  "payload": {"recordId":"consume-base-001","reservationId":"reserve-base-001","sheetId":"sheet-base-001","consumedQuantity":1}
}
