{
  "eventId": "evt-foundation-bom-version-pending-demo-001",
  "eventType": "foundation.bom.version.pending",
  "occurredAt": "2026-02-22T12:00:00Z",
  "producer": "foundation",
  "workspaceId": "workspace-demo",
  "payloadVersion": "1.0.0",
  "payload": {"versionId":"BOM-demo-pending","status":"PENDING_ADOPTION","triggerSource":"tekla-adapter","affectedPartIds":["part-demo-001","part-demo-002"]}
}
