{
  "eventId": "evt-foundation-inventory-synced-edge-001",
  "eventType": "foundation.inventory.synced",
  "occurredAt": "2026-02-22T12:00:00Z",
  "producer": "foundation",
  "workspaceId": "workspace-edge",
  "payloadVersion": "1.0.0",
  "payload": {"syncId":"sync-edge-001","sheetCount":3,"source":"wms-adapter","status":"SUCCESS"}
}
