{
  "eventId": "evt-foundation-sheet-consumption-rolledback-demo-001",
  "eventType": "foundation.sheet.consumption.rolledback",
  "occurredAt": "2026-02-22T12:00:00Z",
  "producer": "foundation",
  "workspaceId": "workspace-demo",
  "payloadVersion": "1.0.0",
  "payload": {"recordId":"consume-demo-001","reservationId":"reserve-demo-001","reason":"sync_wms_failed"}
}
