{
  "eventId": "evt-foundation-sheet-consumption-rolledback-base-001",
  "eventType": "foundation.sheet.consumption.rolledback",
  "occurredAt": "2026-02-22T12:00:00Z",
  "producer": "foundation",
  "workspaceId": "workspace-base",
  "payloadVersion": "1.0.0",
  "payload": {"recordId":"consume-base-001","reservationId":"reserve-base-001","reason":"sync_wms_failed"}
}
