{
  "eventId": "evt-foundation-sheet-consumption-committed-edge-001",
  "eventType": "foundation.sheet.consumption.committed",
  "occurredAt": "2026-02-22T12:00:00Z",
  "producer": "foundation",
  "workspaceId": "workspace-edge",
  "payloadVersion": "1.0.0",
  "payload": {"recordId":"consume-edge-001","reservationId":"reserve-edge-001","sheetId":"sheet-edge-001","consumedQuantity":1}
}
