{
  "eventId": "evt-foundation-bom-version-pending-base-001",
  "eventType": "foundation.bom.version.pending",
  "occurredAt": "2026-02-22T12:00:00Z",
  "producer": "foundation",
  "workspaceId": "workspace-base",
  "payloadVersion": "1.0.0",
  "payload": {"versionId":"BOM-base-pending","status":"PENDING_ADOPTION","triggerSource":"tekla-adapter","affectedPartIds":["part-base-001","part-base-002"]}
}
