{
  "eventId": "evt-foundation-bom-version-pending-edge-001",
  "eventType": "foundation.bom.version.pending",
  "occurredAt": "2026-02-22T12:00:00Z",
  "producer": "foundation",
  "workspaceId": "workspace-edge",
  "payloadVersion": "1.0.0",
  "payload": {"versionId":"BOM-edge-pending","status":"PENDING_ADOPTION","triggerSource":"tekla-adapter","affectedPartIds":["part-edge-001","part-edge-002"]}
}
